{
  "name": "Solar Flare",
  "type": "radial",
  "stops": [
    { "color": "#ffb347", "position": 0 },
    { "color": "#c2441e", "position": 35 },
    { "color": "#5c1a0a", "position": 65 },
    { "color": "#0f0503", "position": 100 }
  ],
  "angle": 0,
  "intensity": 95,
  "animation": false,
  "speed": 8,
  "radialPosX": 50,
  "radialPosY": 40,
  "radialShape": "ellipse",
  "radialSize": "farthest-corner"
}
