{
  "name": "Arctic Frost",
  "type": "linear",
  "stops": [
    { "color": "#0a1628", "position": 0 },
    { "color": "#1a3a5c", "position": 35 },
    { "color": "#2e6b8a", "position": 65 },
    { "color": "#0d1f33", "position": 100 }
  ],
  "angle": 200,
  "intensity": 85,
  "animation": false,
  "speed": 8,
  "radialPosX": 50,
  "radialPosY": 50,
  "radialShape": "ellipse",
  "radialSize": "farthest-corner"
}
